{
  "definition_format_version": "2.0.0",
  "protocol_id": "field_report_area_description",
  "version": "3.0.0",
  "name": "Fältrapport – områdesbeskrivning",
  "language": "sv",
  "updated_at": "2026-09-22T00:00:00Z",
  "description": "Fristående protokolldefinition med webbplatsens exakta fältnamn, lagrade svarsvärden och JSON-format. Fältetiketter och alternativens label får översättas; id och value får inte ändras inom en protokollversion.",
  "sections": [
    {
      "id": "overview",
      "kind": "section",
      "label": "Överblick",
      "children": [
        {
          "field_ref": "sammanfattning"
        },
        {
          "field_ref": "mapImage"
        }
      ]
    },
    {
      "id": "identity",
      "kind": "section",
      "label": "Grunduppgifter",
      "children": [
        {
          "id": "area",
          "kind": "group",
          "label": "Område",
          "children": [
            {
              "field_ref": "delomradeId"
            },
            {
              "field_ref": "namn"
            },
            {
              "field_ref": "kommun"
            },
            {
              "field_ref": "fastighet"
            },
            {
              "field_ref": "areal"
            },
            {
              "field_ref": "datum"
            },
            {
              "field_ref": "inventerare"
            },
            {
              "field_ref": "polygonGeojson"
            },
            {
              "field_ref": "centerCoordinate"
            }
          ]
        },
        {
          "id": "method",
          "kind": "group",
          "label": "Inventeringsmetod",
          "children": [
            {
              "field_ref": "metod"
            },
            {
              "field_ref": "metodDetalj"
            }
          ]
        },
        {
          "id": "coverage",
          "kind": "group",
          "label": "Inventeringens täckning",
          "children": [
            {
              "field_ref": "tackning"
            }
          ]
        },
        {
          "id": "limitations",
          "kind": "group",
          "label": "Begränsningar",
          "children": [
            {
              "field_ref": "begransning"
            },
            {
              "field_ref": "svamptillgang"
            },
            {
              "field_ref": "begransningDetalj"
            }
          ]
        }
      ]
    },
    {
      "id": "tree_layer",
      "kind": "section",
      "label": "Träd",
      "children": [
        {
          "field_ref": "skogstyp"
        },
        {
          "field_ref": "tradslag"
        },
        {
          "field_ref": "tradslagDetalj"
        },
        {
          "field_ref": "sarskildSkog"
        },
        {
          "field_ref": "aldersstruktur"
        },
        {
          "field_ref": "skiktning"
        },
        {
          "field_ref": "bestandsstruktur"
        },
        {
          "field_ref": "alderDiameter"
        },
        {
          "field_ref": "dominerandeAlder"
        }
      ]
    },
    {
      "id": "ground_vegetation",
      "kind": "section",
      "label": "Markvegetation",
      "children": [
        {
          "field_ref": "vegetation"
        },
        {
          "id": "ground_layer",
          "kind": "group",
          "label": "Markskikt (mossor och lavar)",
          "description": "Markskiktet är det understa vegetationsskiktet i skogen. Det befinner sig direkt på markytan (eller på stenar och stubbar) och består uteslutande av mossor, lavar och svampar. Till skillnad från fältskiktet innehåller markskiktet inga kärlväxter (arter med rötter och stammar). Det sträcker sig höjdmässigt från marknivån upp till maximalt några centimeter",
          "children": [
            {
              "field_ref": "markskiktTackning"
            },
            {
              "field_ref": "markskiktTyp"
            },
            {
              "field_ref": "markskiktArter"
            },
            {
              "field_ref": "markskiktStruktur"
            }
          ]
        },
        {
          "id": "field_layer",
          "kind": "group",
          "label": "Fältskikt (rikörter)",
          "description": "Fältskiktet är det vegetationsskikt i skogen som består av ris, örter, gräs, halvgräs (starr), ormbunkar, fräken- och lummerväxter. Det innefattar även mycket små träd- och buskplantor som är lägre än 0,5 meter. Höjdmässigt sträcker sig fältskiktet från markytan (ovanför moss- och lavlagret) upp till cirka 0,5 meter (även om enstaka manshöga örter biologiskt sett också räknas hit)",
          "children": [
            {
              "field_ref": "faltskiktTackning"
            },
            {
              "field_ref": "faltskiktTyp"
            },
            {
              "field_ref": "faltskiktArter"
            },
            {
              "field_ref": "faltskiktStruktur"
            }
          ]
        },
        {
          "id": "shrub_layer",
          "kind": "group",
          "label": "Buskskikt (1–5 m)",
          "description": "Buskskiktet är det vegetationsskikt i skogen som befinner sig höjdmässigt mellan fältskiktet och trädskiktet. Den vedertagna definitionen omfattar all vedartad vegetation (buskar och träd) som har en höjd på mellan 0,5 meter och 5 meter. Skiktet består dels av renodlade buskarter, dels av ungträd (uppslag/underväxt) som ännu inte nått trädskiktets höjd.",
          "children": [
            {
              "field_ref": "buskskiktTackning"
            },
            {
              "field_ref": "buskskiktArter"
            },
            {
              "field_ref": "buskskiktStruktur"
            }
          ]
        }
      ]
    },
    {
      "id": "habitat_trees",
      "kind": "section",
      "label": "Naturvärdesträd",
      "children": [
        {
          "field_ref": "nvt0"
        },
        {
          "field_ref": "nvt1"
        },
        {
          "field_ref": "nvt2"
        },
        {
          "field_ref": "nvt3"
        },
        {
          "field_ref": "nvt4"
        },
        {
          "field_ref": "nvt5"
        },
        {
          "field_ref": "nvt6"
        },
        {
          "field_ref": "naturvardestradKommentar"
        }
      ]
    },
    {
      "id": "terrain",
      "kind": "section",
      "label": "Terräng",
      "children": [
        {
          "field_ref": "topografi"
        },
        {
          "field_ref": "jordart"
        },
        {
          "field_ref": "markfuktighet"
        },
        {
          "field_ref": "hydrologi"
        },
        {
          "field_ref": "markkemi"
        },
        {
          "field_ref": "strukturer"
        },
        {
          "field_ref": "terrangKommentar"
        }
      ]
    },
    {
      "id": "deadwood",
      "kind": "section",
      "label": "Död ved",
      "children": [
        {
          "id": "deadwood_lying",
          "kind": "group",
          "label": "Liggande död ved",
          "children": [
            {
              "field_ref": "ved_liggande"
            },
            {
              "field_ref": "ved_liggande_kommentar"
            }
          ]
        },
        {
          "id": "deadwood_standing",
          "kind": "group",
          "label": "Stående död ved",
          "children": [
            {
              "field_ref": "ved_staende"
            },
            {
              "field_ref": "ved_staende_kommentar"
            }
          ]
        }
      ]
    },
    {
      "id": "processes_impact",
      "kind": "section",
      "label": "Påverkan",
      "children": [
        {
          "field_ref": "processer"
        },
        {
          "field_ref": "paaverkan"
        },
        {
          "field_ref": "skador"
        },
        {
          "field_ref": "markanvandning"
        }
      ]
    },
    {
      "id": "species_observations",
      "kind": "section",
      "label": "Arter",
      "children": [
        {
          "field_ref": "naturvardsarter"
        },
        {
          "field_ref": "kollektnoteringarDna"
        }
      ]
    },
    {
      "id": "landscape_context",
      "kind": "section",
      "label": "Landskap",
      "children": [
        {
          "field_ref": "anslutande"
        },
        {
          "field_ref": "landskap"
        },
        {
          "field_ref": "grans"
        },
        {
          "field_ref": "landskapKommentar"
        }
      ]
    },
    {
      "id": "documentation",
      "kind": "section",
      "label": "Dokumentation",
      "children": [
        {
          "field_ref": "image1"
        },
        {
          "field_ref": "image2"
        },
        {
          "field_ref": "image3"
        }
      ]
    }
  ],
  "fields": [
    {
      "id": "sammanfattning",
      "label": "Sammanfattning",
      "type": "text",
      "required": false,
      "storage": "fields",
      "description": "Beskriv områdets viktigaste karaktärer och naturvärdesstrukturer. Ange om någon del inte har kunnat inventeras."
    },
    {
      "id": "delomradeId",
      "label": "Delområde-ID",
      "type": "text",
      "required": false,
      "storage": "fields"
    },
    {
      "id": "namn",
      "label": "Namn på delområde",
      "type": "text",
      "required": false,
      "storage": "fields"
    },
    {
      "id": "kommun",
      "label": "Kommun / Ort",
      "type": "text",
      "required": false,
      "storage": "fields"
    },
    {
      "id": "fastighet",
      "label": "Fastighetsbeteckning",
      "type": "text",
      "required": false,
      "storage": "fields"
    },
    {
      "id": "areal",
      "label": "Areal",
      "type": "decimal",
      "required": false,
      "storage": "fields",
      "unit": "ha",
      "minimum": 0,
      "step": 0.01
    },
    {
      "id": "datum",
      "label": "Inventeringsdatum",
      "type": "date",
      "required": false,